year,question no,context,question,A,B,C,D,answer,region
2018,28,,. A disadvantage of vegetative propagation is that,plants are true to type,fruits are small in size,plants take a long time to mature,diseases are easily transferred to offspring,D,international
2018,29,,An effective method of preventing viral diseases in crops is by,treating the seeds with fungicides,practicing crop rotation,regular spraying of crops,planting resistant varieties,D,international
2018,30,,A groundnut plant showing stunted growth with yellow or mottled leaves is likely to be infected with,blight,tikka,rosette,anthracnose,C,international
2018,37,,A farmer observed that all his day-old chicks clustered around the source of heat in a brooder house. This observation is likely due to,manifestation of a disease outbreak,thirst because of inadequate water,poor nutrition,low temperature,D,international
2018,38,,Which of the following practices ensures that a young animal has resistance against diseases?,regular visits of the veterinary doctors,Giving the animal a maintenance ration,regular dipping of animal,giving the animal access to colostrums,D,international
2018,41,,Vitamin K deficiency in farm animals causes,night blindness,. sterility in both sexes,delayed blood clothing,delayed ovulation,C,international
2018,42,,Which of the following methods is not used in collecting semen for artificial insemination?,massage method,Use of artificial vagina,herd mating of the animals,Electro-ejaculation method,C,international
2018,43,,Complete eradication of tsetse flies will be an effective control measure for,aspergillosis,trypanosomiasis,fowl pox,swinr fever,B,international
2018,44,,. Which of the following diseases is caused by a virus?,Brucellosis,Trypanosomiasis,Rinderpest,Tuberculosis,C,international
2018,45,,Bees are regarded as friends of the farmer because they,usually sting the farmer,are harmless insects,help in pollination,produce nectar for human use,C,international
2018,49,,Which of the following farm documents is usually prepared at the end of the year?,farm budget,labour record,farm inventory,profit and loss account,D,international
2018,50,,Which of the following agricultural extension methods is aimed at reaching an individual farmer at a particular time?,film show,. farm visit,electronic media,. field trip,B,international
,,,,,,,,,
,,,,,,,,,
2019,1,,Which of the following statements best describes commercial farming?,Production of plants and animals for family consumption,Large scale agricultural production for sale,Large scale agricultural production for family consumption,Use of family labour for large scale agricultural production,B,international
2019,2,,"Which of the following problems are associated with agricultural marketing in West Africa?
  I. Seasonality of produce
  Il. Transportation of produce
  Ill. Access to credit",A. I and II only,I and III only,Il and Ill only,". I, Il and III",A,africa
2019,3,,An advantage of communal land tenure system is that it,encourages use of land for permanent projects by individuals.,makes land cheap to acquire.,leads to fragmentation.,does not promote farm mechanization.,B,international
2019,4,,Which of the following implements is used for primary tillage?,Ridger,cultivator,plough,Harrow,C,international
2019,6,,. A disadvantage of farm mechanization is,efficiency in farming.,displacement of farm workers.,reduction in health hazards.,timeliness of farm operations.,B,international
2019,7,,Calculate in hectares the area of a rectangular farmland with dimensions 50 m by 25 m.,125 ha,12.5 ha,1.25 ha,0.125 ha,D,international
2019,8,,"The practice of measuring and mapping out the size, position and boundary of a farmland is called farm",layout,business,surveying,tillage,C,international
2019,9,,Which of the following statements about land is not correct?,. Its supply is limited,It is used for agricultural production,It is subject to depreciation,It can be relocated,D,international
2019,10,,A socio-cultural factor affecting land availability is,soil type,religion,topography,mining,B,international
2019,11,,A biotic factor affecting agricultural production is A. rainfall. B. predator.,rainfall,predator,humidity,temperature,B,international
2019,12,,Which of the following groups of organisms are parasitic plants?,"Nematode, fungus and bacterium","Striga, nematode and dodder","Dodder, fungus and striga","Mistletoe, fungus and bacterium",C,international
2019,13,,The type of rock formed from accumulation of materials transported by water is called,sedimentary rock.,igneous rock.,metamorphic rock.,plutonic rock.,A,international
2019,14,,"A fresh garden soil sample weighed 25 kg. When oven-dried, its weight reduced to 20 kg. Calculate the percentage moisture content of the soil sample.",5.00%,12.50%,20.00%,25.00%,C,international
2019,15,,Which of the following mineral elements is essential for chlorophyll formation?,Calcium,Boron,Sodium,Magnesium,D,international
2019,17,,Liquid fertilizers and pesticides could be applied through,furrow irrigation.,channel irrigation.,sprinkler irrigation.,flood irrigation,C,international
2019,18,,"In a crop rotation system, it is usually preferred that cassava comes last in the rotation because it",adds nitrogen to the soil.,is a shallow feeder.,is a deep rooted crop.,is a perennial crop.,B,africa
2019,19,,The growing of only one crop on a piece of land from year to year is known as,mixed cropping.,crop rotation,monoculture,shifting cultivation,C,international
2019,29,,"In green manuring, crops are ploughed into the soil just before flowering in order to",control soil pathogens.,enrich the soil with nutrients.,control soil erosion.,increase the soil temperature.,B,international
2019,21,,"Corns, rhizomes and tubers are examples of",underground roots.,underground stems.,aerial stems.,modified leaves.,B,international
2019,22,,Which of the following statements is not a reason for budding? The resulting plants,can withstand adverse climatic conditions.,flower and fruit early.,are more disease resistant.,develop broader leaves for photosynthesis.,A,international
2019,23,,"Which of the following statements are advantages of mulching? It 
  I. controls weeds.
  II. conserves soil moisture.
  Ill. increases soil temperature.
  IV. reduces soil pH.",I and II,I and III,II and IV,Ill and IV,A,international
2019,24,,A planting material used in propagating plantain is the,crown.,peeper.,slip.,leaf.,A,nigeria
2019,25,,"If maize seed is sown at a spacing of 100cm x 50cm, determine the expected maize plant population per hectare.","40,000","20,000","5,000","2,000",B,international
2019,26,,Protective functions of forests include the following except,soil conservation.,serving as windbreak.,purification of air.,source of firewood,D,international
2019,27,,The growing of both trees and arable crops on the same piece of land is,ley farming.,mixed farming.,forestry.,taungya system.,D,international
2019,28,,Sexual propagation of omamental plants involves the use of,stems.,seeds.,suckers,rhizomes,B,international
2019,29,,The vector of leaf curl disease of cotton is,grasshopper.,termites,thrips,white fly,D,international
2019,30,,. A major storage pest of cereals in West Africa is,stem borer.,. weevil.,bird,army worm,B,africa
2019,31,,. Biological control of insect-pests of crops is carried out through,crop rotation.,use of predators.,use of pesticides.,farm sanitation,B,international
2019,32,,"During the production of palm oil, the oil palm fruits are boiled in order to",harden the kernel.,prevent high level of oil rancidity.,extract oil from the palm fruit.,separate mesocarp from endocarp.,D,nigeria
2019,33,,Which of the following breeds of cattle is exotic?,Sokoto Gudali,Ndama,fresian,Muturu,C,africa
2019,36,,Which of the following hormones is responsible for ostrus in farm animals?,Oxytocin,Oestrogen,Prolactin,Progesterone,B,international
2019,37,,"In animal production, immature spermatozoa are stored in the",urethra.,scrotum.,epididymis.,prostate gland.,C,international
2019,38,,The least important factor for successful incubation of eggs is,light.,temperature,ventilation,humidity,A,international
2019,39,,A wallow should be provided in the pen of pigs in order to,reduce the feed intake of pigs.,increase the water intake of pigs.,enable the pigs to swim.,cool the temperature of pigs.,D,international
2019,42,,. Bone meal is usually included in the diet of livestock to supply,calcium and phosphorus.,calcium and iodine.,phosphorus and iron.,magnesium and sodium.,A,international
2019,43,,"Which of the following statements about inbreeding in farm animals is/are false?
  I. Inbred animals reach market weight early
  II. Inbred animals have reduced vigour
  Ill. Inbreeding increases the occurrences of undesirable traits",I only,Il only,I and Il only,I and Ill only,A,international
2019,44,,Which of the following parasites may be found in the gut of livestock?,Tick,Flea,Roundworm,Louse,C,international
2019,45,,Vegetative growth in fish ponds,makes fish movements easy.,regulates water acidity.,increases pond water turbidity.,moderates pond temperature,D,international
2019,46,,Which of the following factors of agricultural production is abundant in rural areas?,Enterprise,Land,Labour,Capital,C,africa
2019,50,,A major characteristic of mass teaching method of agricultural extension is that,information can be directed to a large number of people at different locations.,it demonstrates how to carry out new techniques to farmers in the same locality.,feedback is readily available to extension officers.,it summarizes and analyses what had been done in previous learning situations.,B,international
,,,,,,,,,
,,,,,,,,,
2020,1,,A nation exports agricultural produce mainly to,provide food.,create employment,. earn foreign exchange,provide raw materials.,A,international
2020,2,,Quarantine measures in agriculture are aimed at,regulating cost of importation of crops and animals.,preventing the introduction of pests and diseases,maintaining genetic purity of crops and animals.,introducing new varieties of crops and breeds of animals.,B,international