year,question_no,context,question,A,B,C,D,answer,region
2018,10,,. An association of businesses engaged In both trade and industry is a,co-operative society,trade union,trust fund,chamber of commerce,,international
2018,11,,Which of the following statements is true of a debenture?,Its holders receive interest,It forms part of company's authorized capital,Its holders are co-owners of the company,Its holders control the company,,international
2018,12,,The path through which a product moves from the manufacturer to the consumer is a,channel of communication,line of production,means of transportation,channel of distribution,,international
2018,13,,"If the opening stock of Ali Ltd is N40;000, cost of goods sold is N48,000 and closing stock is N24,000, its rate of turnover will be",1.2 times,1.5 times,2.0 times,7.5 times,,international
2018,14,,A business which requires a certificate of trading in order to commence operation is,co-operative society,private company,sole proprietorship,public company,,international
2018,15,,Exchange of goods in international market which does not involve the use of money is,barter trade,entrepot trade,counter trade,bilateral trade,,international
2018,16,,Which of the following features is not associated with a chamber of commerce? It is,Democratically administered,an independent association,open only to entrepreneurs,a voluntary association,,international
2018,17,,The reason for sending a proforma invoice to a potential customer is that it is,. an indication of the seller's willingness to grant credit,a polite way of telling the customer to return the goods,an invitation to the buyer to buy on hire purchase,a polite way of refusing to sell on credit,,international
2018,18,,The insurance policy taken to cover dishonesty of accounts personnel of an organisation is,employer's liability,fidelity guarantee,life endowment,marine insurance,,international
2018,19,,Which of the following documents is used when goods are being sent by a common carrier?,Delivery nite,Consignment nnote,Advice note,Credit note,,international
2018,20,,A put option in the stock exchange is an option,to sell,not to sell,to buy,not to buy,,international
2018,21,,The functions of money do not include,store of value,medium of exchange,double coincidence of wants,means of deferred payment,,international
2018,22,,"A document of title to goods written by the ship owner, specifying that certain goods are being conveyed in the ship is a",bill of sale,bill of sight,bill of entry,bill of lading,,international
2018,23,,Informative advertising is aimed at,giving advice on the use of a product,influencing customers to buy a product,giving gifts to attract customers,encouraging specific customers to buy a product,,international
2018,24,,A cheap means of carrying bulky goods over long distance is by,rail,road,air,pipeline,,international
2018,25,,A contract terminated by the occurrence of an event which makes performance impossible is discharge by,breach,agreement,frustration,performance,,international
2018,26,,An individual employed to act on behalf of another within a specified guideline is,a jobber,an agent,broker,a distributor,,international
2018,27,,Which of the following is not a component of the marketing mix?,Price,place,population,Product,,international
2018,28,,A method of buying in anticipation of price fluctuation in the commodity market is,Speculation,arbitrage,contango,hedging,,international
2018,29,,A shipping do cora spectaling the charges for carrying a particular car oil off aired voyage is,dock warrant,right note,a bill of lading,mate's receipt,,international
2018,30,,Commercial gets who are authorized to keep goods until they are sold are,Factors,distributors,brokers,. auctioneers,,international
2018,31,,An advertisement method whose objective is to convince customers to buy a product is,informative advertisement,persuasive advertisement,competitive advertisement,mass advertisement,,international
2018,32,,A government legislation which ensures that quality goods and services are available to customers is,Hire Purchase Act,Copyright Act,Price control Act,Standard Organisation Act,,international
2018,33,,A bank draft is a cheque draw by a bank on,another bank,. itself,creditors,Customers' deposits,,international
2018,34,,A company is quoted on the stock exchange when its shared are,Put under private placement,not for sale to the public,Listed for sale on the exchange,Owned by the government,,international
2018,35,,Which of the following functions is not performed by the export promotion council?,Prevention of importation of harmful goods,Provision of credit facilities to exporters,Provision of technical advice to exporters,Creation of export free Zones,,international
2018,36,,Activities undertaken to create awareness of a product by giving out samples or gifts is,Marketing mix,marketing concepts,window display,sales promotion,,international
2018,37,,An advantage of privatizing a firm is that it,becomes more efficient,sells good at low prices,Employs more workers,Attracts more customers,,international
2018,38,,The transfer of authority by a superior officer to his subordinate in an organisation is,Controlling,decentralization,delegation,directing,,international
2018,39,,The provision of scholarships by a firm to needy students is part of its,Political responsibility,economic responsibility,social responsibility,legal responsibility,,international
2018,40,,How many countries form ECOWAS?,17,16,15,14,,africa
2018,41,,Which of the following is a modern means of communication?,Grape vine,E-mail,whistles,Town crier,,international
2018,42,,A system of issuing new shared to selected investors instead of the general public is,Public offer,Issue by tender,offer for sale,private placement,,international
2018,43,,. One of the aims of the European Union is to,ease trade among member countries.,Enhance better trade with Africa,enhance free trade with America,offer financial assistance to poor countries,,international
2018,44,,The purpose of commercialization is to,Encourage the participation of the private sector,make state-owned firms more efficient,Encourage the flow of foreign capital,enables state-owned firms pay tax,,international
2018,45,,The time allowed for loading and unloading a ship at the harbour is,Demurrage,tenure,lay days,dead freight,,international
2018,46,,Interbank indebtedness is settled at the,clearing house,money market,discount house,stock exchange,,international
2018,47,,The concern of a marketing manager whose company has adopted the marketing concept is to,Recruit more salesmen,make maximum profit,Identify and satisfy customers needs,maintain the company's share of the market.,,international
2019,48,,A firm which turns timber into wooden office desks belongs to the,extractive industry,direct service industry,indirect service industry,construction industry,,international
2019,49,,E-commerce is an activity which involves,trading in products through the post office,trading in products through the internet,buying and selling of products through telegram messages,buying and selling of products through fax messages,,international
2019,50,,Rent is the return on,a loan,labour,land,a share,,international